rank,post_title,site,job_link,company_name,job_profile,salary_range,job_location,founding_year,team_size,company_hq,post_date,role_description
1,Svix (YC W21) Is Hiring a Developer Marketer (US Remote),svix.com,https://www.svix.com/careers/,,,,,,,,2025-01-30T21:00:10 1738270810,
2,Great Question (YC W21) Is Hiring Lead Product Designer,ycombinator.com,https://www.ycombinator.com/companies/great-question/jobs/T5RTrue-lead-product-designer,Great Question,Lead Product Designer,$150K - $180K,"United States (Remote) / Remote (CO, US; Oakland, CA, US)",2020,22,"Oakland, CA",2025-01-30T17:00:00 1738256400,"Great Question is the all-in-one customer research platform for understanding your customers. Run interviews, surveys, and prototype tests while using AI to analyze it all in one place."
3,Codes Health (YC S24) Is Hiring,Site not found,item?id=42877004,,,,,,,,2025-01-30T12:00:46 1738238446,
4,Etleap (YC W13) Is Hiring a Senior Software Engineer (SF),Site not found,item?id=42873532,,,,,,,,2025-01-30T01:02:03 1738198923,
5,Frigade (YC W23) is hiring engineer #2,ycombinator.com,https://www.ycombinator.com/companies/frigade/jobs/KUwAluN-senior-full-stack-engineer,Frigade,Senior Full Stack Engineer,$130K - $180K / 0.50% - 1.50%,"San Francisco, CA, US",2022,4,San Francisco,2025-01-29T17:00:50 1738170050,"We’re looking for an experienced software engineer who embraces the breadth of responsibilities that come with a senior full-stack role. You’ll collect and prioritize feedback directly from customers, figure out the best way to solve their problems, and drive the work to get it done.

We’d never say something like “deep cross-functional impact” out loud, but our CEO does routinely ship code and our UI engineer is currently editing this job posting, so draw your own conclusions there. We highly value the ability to step up and solve the problem at hand with an entrepreneurial spirit, a designer's eye for detail, and the rigor of an engineer whose cell number is saved in PagerDuty."